id,title,keywords,alt_text,attribution,attribution_url,url,filename
2748,Catherine Bowes headshot,,Catherine Bowes headshot,,,https://barrfdn-prod.s3.amazonaws.com/image/2748/original.jpeg,2748.jpeg
2749,offshore wind project,,A large offshore deep water wind project is built. ,Deepwater Wind,http://dwwind.com/,https://barrfdn-prod.s3.amazonaws.com/image/2749/original.jpeg,2749.jpeg
2750,Springpoint School for Law and Justice Hands Raised,,Two students raise their hands in a high school classroom. ,,,https://barrfdn-prod.s3.amazonaws.com/image/2750/original.jpg,2750.jpg
2754,maure square headshot world music,,maure square headshot world music,,,https://barrfdn-prod.s3.amazonaws.com/image/2754/original.jpg,2754.jpg
2755,maure headshot world music,,maure headshot world music,,,https://barrfdn-prod.s3.amazonaws.com/image/2755/original.jpg,2755.jpg
2756,WMCA Take a bow,,Dancers take a bow after a ballet performance. ,,,https://barrfdn-prod.s3.amazonaws.com/image/2756/original.jpg,2756.jpg
2757,wmca take a bow square,,wmca take a bow square,,,https://barrfdn-prod.s3.amazonaws.com/image/2757/original.jpg,2757.jpg
2758,Maure Video Headshot,,Maure Video Headshot,,,https://barrfdn-prod.s3.amazonaws.com/image/2758/original.png,2758.png
2759,WMCA two ballet dancers ,,Two ballet dancers dance on stage. ,,http://worldmusic.org,https://barrfdn-prod.s3.amazonaws.com/image/2759/original.jpg,2759.jpg
2760,Step Team Kipp Lynn,,Three students practice a dance routine in their high school hallway. ,Paul Schnaittacher,https://photogman.smugmug.com/,https://barrfdn-prod.s3.amazonaws.com/image/2760/original.jpg,2760.jpg
2761,2018 Year in Review,,2018 Year in Review,,,https://barrfdn-prod.s3.amazonaws.com/image/2761/original.jpg,2761.jpg
2762,YIR collage,,2018 Year in Review,,,https://barrfdn-prod.s3.amazonaws.com/image/2762/original.jpg,2762.jpg
2763,YIR Effective Partners,,Graphic showing the five actions of effective partners.,,,https://barrfdn-prod.s3.amazonaws.com/image/2763/original.jpg,2763.jpg
2764,YIR Listen,"arts, listen",Woman talking in the middle of a circle of people. ,Eva Cruz,https://www.artstrategies.org/,https://barrfdn-prod.s3.amazonaws.com/image/2764/original.jpg,2764.jpg
2765,Waterfront graphic - 2018 review,,Graphic of people enjoying the waterfront,,,https://barrfdn-prod.s3.amazonaws.com/image/2765/original.png,2765.png
2766,Atlantic Wharf Building,waterfront,Woman sitting outside Atlantic Wharf,Ed Wonsek,http://www.halvorsondesign.com/atlantic-wharf/,https://barrfdn-prod.s3.amazonaws.com/image/2766/original.jpg,2766.jpg
2767,Atlantic Wharf Square,,Atlantic Wharf Square,,,https://barrfdn-prod.s3.amazonaws.com/image/2767/original.jpg,2767.jpg
2768,Prerna white background,,Prerna,,,https://barrfdn-prod.s3.amazonaws.com/image/2768/original.jpg,2768.jpg
2769,Prerna brick background,,Prerna,,,https://barrfdn-prod.s3.amazonaws.com/image/2769/original.jpg,2769.jpg
2801,Carolyn Lewenberg,,Carolyn Lewenberg,,https://www.mapc.org/,https://barrfdn-prod.s3.amazonaws.com/image/2801/original.jpg,2801.jpg
2802,MAPC Housing Public Event,,A man and a woman look at a map of Boston together.,,https://www.mapc.org/,https://barrfdn-prod.s3.amazonaws.com/image/2802/original.jpg,2802.jpg
2803,Carol Bove Art image,,A photograph of a sculpture by Carol Bove. ,,,https://barrfdn-prod.s3.amazonaws.com/image/2803/original.jpg,2803.jpg
2805,Jeffrey Gibson art picture,,Jeffrey Gibson art picture,,,https://barrfdn-prod.s3.amazonaws.com/image/2805/original.jpg,2805.jpg
2838,Phoenix Academy Black Teacher talking,,A teacher talks in the front of the class. ,Paul Schnaittacher,https://photogman.smugmug.com/,https://barrfdn-prod.s3.amazonaws.com/image/2838/original.jpg,2838.jpg
2839,Kipp Lynn Colleagiate Girl Smiles,,A girl smiles at the camera at her desk. ,Paul Schnaittacher,https://photogman.smugmug.com/,https://barrfdn-prod.s3.amazonaws.com/image/2839/original.jpg,2839.jpg
2840,Kipp Lynn Colleagiate Boy at computer Smiles,,A boy laughs with his classmates at the computer. ,Paul Schnaittacher,https://photogman.smugmug.com/,https://barrfdn-prod.s3.amazonaws.com/image/2840/original.jpg,2840.jpg
2841,Kipp Lynn Colleagiate Girls Smile in Hallways,,Three girls smile in their school hallway. ,Paul Schnaittacher,https://photogman.smugmug.com/,https://barrfdn-prod.s3.amazonaws.com/image/2841/original.jpg,2841.jpg
2842,Kipp Lynn Colleagiate Girls at Desk Laugh,,Four girls laugh at their desks. ,Paul Schnaittacher,https://photogman.smugmug.com/,https://barrfdn-prod.s3.amazonaws.com/image/2842/original.jpg,2842.jpg
2843,Rogers High School Kids Smile Hallway,,Kids smile in their school hallway. ,William S. Rogers High School,https://www.npsri.net/rhs,https://barrfdn-prod.s3.amazonaws.com/image/2843/original.jpg,2843.jpg
2844,Women Look at Wind Turbines on a Boat,,Three women look at offshore wind turbines from a cruise. ,,https://www.nwf.org/,https://barrfdn-prod.s3.amazonaws.com/image/2844/original.jpg,2844.jpg
2845,NWF logo,,NWF logo,,,https://barrfdn-prod.s3.amazonaws.com/image/2845/original.jpg,2845.jpg
2846,SLC Ripples Photo,,SLC Ripples Photo,Photo courtesy of the artist,http://www.silvialopezchavez.com/,https://barrfdn-prod.s3.amazonaws.com/image/2846/original.jpg,2846.jpg
2847,Transcend education graphic,,Transcend education graphic,Image courtesy of Transcend,http://www.transcendeducation.org/,https://barrfdn-prod.s3.amazonaws.com/image/2847/original.png,2847.png
2848,MyWays Infographic,,MyWays Infographic,Image courtesy of NGLC,https://www.nextgenlearning.org/,https://barrfdn-prod.s3.amazonaws.com/image/2848/original.png,2848.png
2849,Holyoke High School Reading script,,Students read a script in a hallway together. ,Paul Schnaittacher,https://www.hps.holyoke.ma.us/,https://barrfdn-prod.s3.amazonaws.com/image/2849/original.jpg,2849.jpg
2852,leo march two smiling people waterfront,,Two people smile on the Boston Harbor. ,Leonardo March,https://www.mneyid.com/,https://barrfdn-prod.s3.amazonaws.com/image/2852/original.jpg,2852.jpg
2853,Victoria Wu headshot,,Victoria Wu headshot,,,https://barrfdn-prod.s3.amazonaws.com/image/2853/original.png,2853.png
2854,MNN annual conference panel,,Four women speak on stage at a panel discussion. ,,http://massnonprofitnet.org/,https://barrfdn-prod.s3.amazonaws.com/image/2854/original.jpg,2854.jpg
2855,Everett Ripple Effect,,A photo of a community garden in Everett. ,,,https://barrfdn-prod.s3.amazonaws.com/image/2855/original.png,2855.png
2856,Sole of Rockland ,,Three people paint on a bench at an outdoors fair. ,,,https://barrfdn-prod.s3.amazonaws.com/image/2856/original.png,2856.png
2857,Leo March Man Looks at Meter,,A man checks the meter on the side of his home. ,Leonardo March,https://www.mneyid.com/,https://barrfdn-prod.s3.amazonaws.com/image/2857/original.jpg,2857.jpg
2858,amy boyd headshot,,amy boyd headshot,,,https://barrfdn-prod.s3.amazonaws.com/image/2858/original.jpg,2858.jpg
2859,man works on a pipe,,A man works on a copper pipe outside of a home. ,Lynn Benander,https://www.cooppower.coop/,https://barrfdn-prod.s3.amazonaws.com/image/2859/original.jpg,2859.jpg
2860,DOE weatherize home,,A homeowner is learning how to improve the efficiency of his home as part of an Energy Department program that assists homeowners weatherize their homes.,Dennis Schroeder,https://www.flickr.com/photos/departmentofenergy/8029621382/in/photolist-dexUFY-vdNPEK,https://barrfdn-prod.s3.amazonaws.com/image/2860/original.jpg,2860.jpg
2861,MNN square logo,,MNN square logo,,,https://barrfdn-prod.s3.amazonaws.com/image/2861/original.png,2861.png
2863,Livable streets kids biking bike lane,,Children and adults bike down a bike lane in Boston. ,, www.livablestreets.info,https://barrfdn-prod.s3.amazonaws.com/image/2863/original.jpg,2863.jpg
2864,Bus Driving by South Station,,A bus speeds by South Station in Boston. ,"Kevin Wiles, Jr.",https://twitter.com/kwilesjrphoto,https://barrfdn-prod.s3.amazonaws.com/image/2864/original.jpg,2864.jpg
2865,Barbara Smiling 2017,,Photo of Barbara Hostetter ,,,https://barrfdn-prod.s3.amazonaws.com/image/2865/original.jpg,2865.jpg
2866,Barbara Smiling cropped ,,Barbara Hostetter,,,https://barrfdn-prod.s3.amazonaws.com/image/2866/original.jpg,2866.jpg
2867,Barbara Smiling option 2,,Barbara Hostetter,,,https://barrfdn-prod.s3.amazonaws.com/image/2867/original.jpg,2867.jpg
2868,mira coalition new citizens sworn in,,New citizens say the pledge of allegiance in a new citizens welcoming ceremony.,,http://www.miracoalition.org/,https://barrfdn-prod.s3.amazonaws.com/image/2868/original.jpg,2868.jpg
2869,mira women here to stay,,Two women hold up protest signs at a rally and smile. ,,http://www.miracoalition.org/,https://barrfdn-prod.s3.amazonaws.com/image/2869/original.jpg,2869.jpg
2870,shanna cleveland headshot,,shanna cleveland headshot,,,https://barrfdn-prod.s3.amazonaws.com/image/2870/original.jpg,2870.jpg
2871,Shanna action shot,staff,Shanna Cleveland speaking engagement,maisa_nyc,https://www.flickr.com/photos/urbanprose/20518657332/in/photostream/,https://barrfdn-prod.s3.amazonaws.com/image/2871/original.jpg,2871.jpg
2872,Leo waterfront extra image castle island,waterfront,Bostonians walking along the harbor in South Boston,Leonardo March,,https://barrfdn-prod.s3.amazonaws.com/image/2872/original.jpg,2872.jpg
2873,Leo March sunset selfie on harbor,waterfront,A family sitting on rocks at the edge of Boston Harbor at sunset,Leonardo March,,https://barrfdn-prod.s3.amazonaws.com/image/2873/original.jpg,2873.jpg
2874,Huntington FAR halfscreen,,A woman uses American sign language on stage. ,,https://www.huntingtontheatre.org/,https://barrfdn-prod.s3.amazonaws.com/image/2874/original.jpg,2874.jpg
2875,Huntington FAR square,,A woman signs on a stage.,,,https://barrfdn-prod.s3.amazonaws.com/image/2875/original.jpg,2875.jpg
2876,Peter DuBois headshot,,Peter DuBois headshot,,,https://barrfdn-prod.s3.amazonaws.com/image/2876/original.jpg,2876.jpg
2877,nasccf people work on a poster,,People work together on a poster on the floor. ,Eva Cruz,https://www.flickr.com/photos/artstrategies,https://barrfdn-prod.s3.amazonaws.com/image/2877/original.jpg,2877.jpg
2878,inp audience reaction,,Audience members smile and clap. ,, www.nonprofitpractice.org,https://barrfdn-prod.s3.amazonaws.com/image/2878/original.jpg,2878.jpg
2879,commerce high school happy kids hallway,,A group of students smile happily in the school hallway.,Commerce High School,https://photogman.smugmug.com/,https://barrfdn-prod.s3.amazonaws.com/image/2879/original.jpg,2879.jpg
2880,dance complex two women dance street,,Two tap dancers dance in the street at night. ,Bill Parsons,http://www.dancecomplex.org,https://barrfdn-prod.s3.amazonaws.com/image/2880/original.jpg,2880.jpg
2881,john dello russo white,,john dello russo white,,,https://barrfdn-prod.s3.amazonaws.com/image/2881/original.jpg,2881.jpg
2882,john dello russo brick,,john dello russo brick,,,https://barrfdn-prod.s3.amazonaws.com/image/2882/original.jpg,2882.jpg
2883,maia white white,,maia white white,,,https://barrfdn-prod.s3.amazonaws.com/image/2883/original.jpg,2883.jpg
2884,maia white brick,,maia white brick,,,https://barrfdn-prod.s3.amazonaws.com/image/2884/original.jpg,2884.jpg
2885,Justin Kang headshot 2019,,Justin Kang,,,https://barrfdn-prod.s3.amazonaws.com/image/2885/original.jpg,2885.jpg
2886,Karilyn Crockett,,Karilyn Crockett,,,https://barrfdn-prod.s3.amazonaws.com/image/2886/original.jpg,2886.jpg
2887,David Howse headshot,fellow,David Howse,,,https://barrfdn-prod.s3.amazonaws.com/image/2887/original.jpg,2887.jpg
2888,Betty Francisco,fellow,Betty Francisco,,,https://barrfdn-prod.s3.amazonaws.com/image/2888/original.jpg,2888.jpg
2889,City Awake Networking,,City Awake Networking,,https://www.cityawake.org/,https://barrfdn-prod.s3.amazonaws.com/image/2889/original.jpg,2889.jpg
2890,City Awake Logo,,City Awake Logo,,,https://barrfdn-prod.s3.amazonaws.com/image/2890/original.jpeg,2890.jpeg
2891,Amplify Latinx Cover Photo,,People raising their hands at a conference,,https://amplifylatinx.co/,https://barrfdn-prod.s3.amazonaws.com/image/2891/original.jpg,2891.jpg
2892,Amplify Latinx Logo,,Amplify Latinx Logo,,,https://barrfdn-prod.s3.amazonaws.com/image/2892/original.jpg,2892.jpg
2893,Creative City Indigo Project,IfeFranklin,Creative City Indigo Project,Ife Franklin,https://www.nefa.org/,https://barrfdn-prod.s3.amazonaws.com/image/2893/original.png,2893.png
2894,CitySpace Group Photo Women,,CitySpace Group Photo Women,@ferryfaerie,https://twitter.com/ferryfaerie/status/1091533728218779648,https://barrfdn-prod.s3.amazonaws.com/image/2894/original.jpg,2894.jpg
2895,wbur cityspace panel discussion,,Panelists talk on stage in front of a seated audience. ,,,https://barrfdn-prod.s3.amazonaws.com/image/2895/original.png,2895.png
2896,panel discussion citspace,,A panel discussion occurs on the stage. ,,,https://barrfdn-prod.s3.amazonaws.com/image/2896/original.jpg,2896.jpg
2898,PV squared solar installation,,Two people install solar panels on a roof. ,Jerry Monkman,http://ecophotography.com/,https://barrfdn-prod.s3.amazonaws.com/image/2898/original.jpg,2898.jpg
2899,todd olinsky paul headshot,,todd olinsky paul headshot,,,https://barrfdn-prod.s3.amazonaws.com/image/2899/original.jpg,2899.jpg
2900,EKG headshot springpoint,,EKG headshot springpoint,,,https://barrfdn-prod.s3.amazonaws.com/image/2900/original.jpg,2900.jpg
2901,michele philips headshot,,michele philips headshot,,,https://barrfdn-prod.s3.amazonaws.com/image/2901/original.jpg,2901.jpg
2902,educause mass ideas convening,,Three teachers work together at a table. ,Mass Ideas,https://massideas.org/,https://barrfdn-prod.s3.amazonaws.com/image/2902/original.jpg,2902.jpg
2903,SL on the ComNet18 Bar,"Stefan Lanfer, ComNet, Communications Network, Curran Theatre, ComNet18",Stefan Lanfer atop a bar in San Francisco's Curran Theatre at the Communications Network's 2018 annual conference,Compass Photographers,https://compassphotographers.photoshelter.com,https://barrfdn-prod.s3.amazonaws.com/image/2903/original.png,2903.png
2904,Todd with behind the meter,,A man stands next to a behind-the-meter battery.,,,https://barrfdn-prod.s3.amazonaws.com/image/2904/original.jpg,2904.jpg
2905,the dance complex hands up,,Dance students take a bow at the end of a street performance. ,Kiersten Resch,https://www.dancecomplex.org/project/kiersten-resch-communications-associate/,https://barrfdn-prod.s3.amazonaws.com/image/2905/original.jpg,2905.jpg
2906,Couple Celebrates Behind the Meter,,A couple celebrates the installation of behind the meter storage in their home. ,Sunrun,https://www.sunrun.com/,https://barrfdn-prod.s3.amazonaws.com/image/2906/original.jpg,2906.jpg
2907,Behind the meter storage celebration,,A couple celebrates the installation of behind the meter storage in their house. ,Sunrun,https://www.sunrun.com/,https://barrfdn-prod.s3.amazonaws.com/image/2907/original.jpg,2907.jpg
2908,Piers Park Sailing Center logo,,Piers Park Sailing Center logo,,,https://barrfdn-prod.s3.amazonaws.com/image/2908/original.png,2908.png
2909,two white men behind the meter,,Two men look at behind the meter storage. ,,,https://barrfdn-prod.s3.amazonaws.com/image/2909/original.jpg,2909.jpg
2910,Piers Park Sailing Center logo - square icon only,,Piers Park Sailing Center logo,,,https://barrfdn-prod.s3.amazonaws.com/image/2910/original.png,2910.png
2911,Shanna Brick,,Shanna Brick,,,https://barrfdn-prod.s3.amazonaws.com/image/2911/original.jpg,2911.jpg
2912,Shanna White headshot,,Shanna White headshot,,,https://barrfdn-prod.s3.amazonaws.com/image/2912/original.jpg,2912.jpg
2913,teenagers on stage huntington,,Teenagers take a bow on the stage. ,,https://huntingtontheatre.org,https://barrfdn-prod.s3.amazonaws.com/image/2913/original.jpg,2913.jpg
2914,shanna white flipped,,shanna white flipped,,,https://barrfdn-prod.s3.amazonaws.com/image/2914/original.jpg,2914.jpg
2915,toxics action center group photos,,Staff at a nonprofit smile and hold a sign. ,,https://toxicsaction.org/,https://barrfdn-prod.s3.amazonaws.com/image/2915/original.jpg,2915.jpg
2916,NEFA Creative City Model,model,Graphic that shows the model of the Creative City program,,,https://barrfdn-prod.s3.amazonaws.com/image/2916/original.jpeg,2916.jpeg
2917,NEFA Creative City Model Graphic,,Graphic showing the model of the Creative City public art program,,,https://barrfdn-prod.s3.amazonaws.com/image/2917/original.png,2917.png
2918,NEFA creative city dancing in the park,,Two people dancing in the park. ,Maureen White Photography,https://www.nefa.org/,https://barrfdn-prod.s3.amazonaws.com/image/2918/original.jpg,2918.jpg
2919,Creative City Neighborhood Map,,Map of Boston neighborhoods,,,https://barrfdn-prod.s3.amazonaws.com/image/2919/original.png,2919.png
2920,Creative City Map 2,,map of Boston neighborhoods,,,https://barrfdn-prod.s3.amazonaws.com/image/2920/original.png,2920.png
2921,Creative City Salsa in park crowd,,Crowd of people dancing salsa in the park.,Maureen White Photography,https://www.nefa.org/,https://barrfdn-prod.s3.amazonaws.com/image/2921/original.jpg,2921.jpg
2922,Couple with solar panel ,,A couple poses with solar panels. ,ReVision Energy,http://ecophotography.com/,https://barrfdn-prod.s3.amazonaws.com/image/2922/original.jpg,2922.jpg
2923,jim klocke headshot,,A headshot of Jim Klocke,,,https://barrfdn-prod.s3.amazonaws.com/image/2923/original.jpg,2923.jpg
2924,mnn mass counts two people,,Two people hold up signs in support of the Census. ,Axie Breen,https://axiebreenphotography.com/,https://barrfdn-prod.s3.amazonaws.com/image/2924/original.jpg,2924.jpg
2925,Massachusetts Census Equity Fund square logo,,Massachusetts Census Equity Fund square logo,,,https://barrfdn-prod.s3.amazonaws.com/image/2925/original.jpg,2925.jpg
2926,Massachusetts Census Equity Fund full logo,,Massachusetts Census Equity Fund full logo,,,https://barrfdn-prod.s3.amazonaws.com/image/2926/original.jpg,2926.jpg
2927,Jill Valdes Horwood headshot BHN,waterfront,Jill Valdes Horwood stands in front of the Boston Harbor,,,https://barrfdn-prod.s3.amazonaws.com/image/2927/original.jpg,2927.jpg
2928,Leo March Waterfront Outtake - people sitting around waterfront,,"Individuals relaxing along the Boston waterfront, reading a book or enjoying the view. ",Leonardo March,,https://barrfdn-prod.s3.amazonaws.com/image/2928/original.jpg,2928.jpg
2929,alex birch headshot,,A headshot of Alex Birch,,https://www.podcastgarage.org,https://barrfdn-prod.s3.amazonaws.com/image/2929/original.jpg,2929.jpg
2930,prx people working at a table,,People gather at a table to work on a podcast. ,Adrianne Mathiowetz,https://www.adriannemathiowetz.com/,https://barrfdn-prod.s3.amazonaws.com/image/2930/original.jpg,2930.jpg
2931,prx two women work at table,,Two women work on a podcast at a table. ,,https://www.podcastgarage.org/,https://barrfdn-prod.s3.amazonaws.com/image/2931/original.jpg,2931.jpg
2932,prx three women panel ,,Three women talk at a panel discussion on podcasting. ,,https://www.podcastgarage.org/,https://barrfdn-prod.s3.amazonaws.com/image/2932/original.jpg,2932.jpg
2933,nglc student panel boy talking,,Students talk on a panel. ,,https://www.nextgenlearning.org/,https://barrfdn-prod.s3.amazonaws.com/image/2933/original.jpg,2933.jpg
2934,prx square logo,,prx square logo,,,https://barrfdn-prod.s3.amazonaws.com/image/2934/original.jpg,2934.jpg
2936,test,,test,,,https://barrfdn-prod.s3.amazonaws.com/image/2936/original.png,2936.png
2937,Metrobus in WBUR,BRT,A group of people board the Metrobús in Mexico City. ,Keith Dannemiller for WBUR,https://www.wbur.org/radioboston/2019/05/02/could-mexico-city-hold-the-key-to-solving-bostons-gridlock,https://barrfdn-prod.s3.amazonaws.com/image/2937/original.jpg,2937.jpg
2938,Leah laughs with grantee,,People talk at a networking event. ,Paul Schnaittacher,https://photogman.smugmug.com/,https://barrfdn-prod.s3.amazonaws.com/image/2938/original.jpg,2938.jpg
2939,Ali Gross headshot classroom,,Ali Gross headshot classroom,,,https://barrfdn-prod.s3.amazonaws.com/image/2939/original.png,2939.png
2940,mass ideas convenings three women post its,,Adults brainstorm new ideas together. ,Mass IDEAS,https://massideas.org/,https://barrfdn-prod.s3.amazonaws.com/image/2940/original.jpg,2940.jpg
2941,ali gross cafe headshot,,ali gross cafe headshot,,,https://barrfdn-prod.s3.amazonaws.com/image/2941/original.png,2941.png
2942,Girl listens chelsea opportunity,,A girl listens to her teacher in a high school classroom. ,,https://www.chelseaschools.com/Domain/16,https://barrfdn-prod.s3.amazonaws.com/image/2942/original.jpg,2942.jpg
2943,solar panel man works on roof,,A man installs a solar panel on a roof. ,Jerry Monkman,http://ecophotography.com/,https://barrfdn-prod.s3.amazonaws.com/image/2943/original.jpg,2943.jpg
2944,Essex County Creates Light show,,People watch a light show outside. ,John Andrew/Creative Collective,https://www.creativecollectivema.com,https://barrfdn-prod.s3.amazonaws.com/image/2944/original.jpg,2944.jpg
2945,essex county punto urban show,,Teens dance outside. ,John Andrew/Creative Collective,https://www.creativecollectivema.com,https://barrfdn-prod.s3.amazonaws.com/image/2945/original.jpg,2945.jpg
2946,melrose girl tv show,,A high student operates a television camera. ,Melrose High School ,https://www.melroseschools.com/melrose-high-school,https://barrfdn-prod.s3.amazonaws.com/image/2946/original.jpg,2946.jpg
2949,Commuter Rail Platform,,People wait to board the commuter rail. ,,https://www.tbf.org/,https://barrfdn-prod.s3.amazonaws.com/image/2949/original.jpg,2949.jpg
2950,Gaverhill Pow Wow Performance,,A woman dances in a pow wow ceremony.,John Andrew/Creative Collective,https://www.creativecollectivema.com,https://barrfdn-prod.s3.amazonaws.com/image/2950/original.jpg,2950.jpg
2951,beth francis headshot,,beth francis headshot,,,https://barrfdn-prod.s3.amazonaws.com/image/2951/original.jpg,2951.jpg
2952,karen ristuben headshot,,karen ristuben headshot,,,https://barrfdn-prod.s3.amazonaws.com/image/2952/original.jpg,2952.jpg
2953,ymca group dances eccf,,A group of teens dance outside. ,John Andrew/Creative Collective,https://www.creativecollectivema.com,https://barrfdn-prod.s3.amazonaws.com/image/2953/original.jpg,2953.jpg
2954,ECCF map,,A map of projects happening in essex county. ,,,https://barrfdn-prod.s3.amazonaws.com/image/2954/original.jpg,2954.jpg
2955,Leo March Boston Creates Beach Balls,arts,Leo March Boston Creates Beach Balls,Leo March,,https://barrfdn-prod.s3.amazonaws.com/image/2955/original.jpg,2955.jpg
2956,Boston Globe Op-Ed art,art,Boston city skyline with illustrations of paint brushes added to it.  ,Lesley Becker,https://www.bostonglobe.com/opinion/2019/06/06/boston-needs-invest-new-generation-artists/5kz6XvszvulNnaKbIvEe6M/story.html,https://barrfdn-prod.s3.amazonaws.com/image/2956/original.jpg,2956.jpg
2957,Paul Grogan headshot,,Photo of Paul Grogan,,,https://barrfdn-prod.s3.amazonaws.com/image/2957/original.jpg,2957.jpg
2958,"Veronica, Boston's First All Women Mariachi band",arts,Boston's First All Women Mariachi band performing. ,Veronica Robles' all women Mariach band  Photo by Richard Howard,https://veronicarobles.com/,https://barrfdn-prod.s3.amazonaws.com/image/2958/original.jpg,2958.jpg
2959,live arts boston group dancing,,A group of young people dance on stage. ,Richard Howard,http://www.richardhowardphotography.com/,https://barrfdn-prod.s3.amazonaws.com/image/2959/original.jpg,2959.jpg
2961,thumbnail principal pipeline executive summary,,thumbnail principal pipeline executive summary,,,https://barrfdn-prod.s3.amazonaws.com/image/2961/original.jpg,2961.jpg
2962,thumbnail principal pipeline report,,thumbnail principal pipeline report,,,https://barrfdn-prod.s3.amazonaws.com/image/2962/original.jpg,2962.jpg
2964,principal pipeline two covers thumbnail,,principal pipeline two covers thumbnail,,,https://barrfdn-prod.s3.amazonaws.com/image/2964/original.png,2964.png
2965,alex papali headshot,,alex papali headshot,,,https://barrfdn-prod.s3.amazonaws.com/image/2965/original.jpeg,2965.jpeg
2966,three people install solar panel,,Three people install solar panels on a roof. ,Jerry Monkman,http://ecophotography.com/,https://barrfdn-prod.s3.amazonaws.com/image/2966/original.jpg,2966.jpg
2967,two men install heat pump in the basement,,Two men install a heat pump in a basement. ,Leonardo March,https://www.mneyid.com/,https://barrfdn-prod.s3.amazonaws.com/image/2967/original.jpg,2967.jpg
2968,Alex Papali New Headshot,,Alex Papali New Headshot,,,https://barrfdn-prod.s3.amazonaws.com/image/2968/original.jpg,2968.jpg
2969,Fall River Three Students Graduate,,Three students graduate at Fall River high school. ,Fall River Public Schools,https://www.fallriverschools.org/,https://barrfdn-prod.s3.amazonaws.com/image/2969/original.jpg,2969.jpg
2970,Portrait of a Graduate Webinar screenshot,,Portrait of a Graduate Webinar screenshot,,,https://barrfdn-prod.s3.amazonaws.com/image/2970/original.png,2970.png
2971,Girl raises hand in classroom,,A girl raises her hand in a classroom. ,Central Falls High School,https://photogman.smugmug.com/,https://barrfdn-prod.s3.amazonaws.com/image/2971/original.jpg,2971.jpg
2972,Phoenix charter girls talking stairs,,Phoenix charter girls talking stairs,,,https://barrfdn-prod.s3.amazonaws.com/image/2972/original.jpg,2972.jpg
2973,phoenix kids laughing in class,,Kids laugh doing schoolwork in a classroom. ,,http://phoenixcharteracademy.org/,https://barrfdn-prod.s3.amazonaws.com/image/2973/original.jpg,2973.jpg
2974,girl in classroom listens phoenix,,A girl listens in a classroom environment. ,,http://phoenixcharteracademy.org/,https://barrfdn-prod.s3.amazonaws.com/image/2974/original.jpg,2974.jpg
