id,title,keywords,alt_text,attribution,attribution_url,url,filename
2975,boy and girl work on artwork commerce high,,A boy and girl work together in a classroom. ,High School of Commerce,https://hscommerce.org/,https://barrfdn-prod.s3.amazonaws.com/image/2975/original.jpg,2975.jpg
3007,Eve Headshot,fellows,Photo of Eve Bridburg,,,https://barrfdn-prod.s3.amazonaws.com/image/3007/original.jpg,3007.jpg
3008,Codman Academy Grad photo,fellows,Students raising their hands on stage on graduation day. ,,https://www.codmanacademy.org/,https://barrfdn-prod.s3.amazonaws.com/image/3008/original.jpg,3008.jpg
3009,Codman Academy Square Logo,,Codman Academy Square Logo,,,https://barrfdn-prod.s3.amazonaws.com/image/3009/original.png,3009.png
3010,Thabiti Headshot,,Thabiti Headshot,,,https://barrfdn-prod.s3.amazonaws.com/image/3010/original.jpg,3010.jpg
3011,Lord headshot new,,Lord headshot new,,,https://barrfdn-prod.s3.amazonaws.com/image/3011/original.jpg,3011.jpg
3012,Mark Culliton Headshot,,Mark Culliton Headshot,,,https://barrfdn-prod.s3.amazonaws.com/image/3012/original.jpg,3012.jpg
3013,Mark Culliton Headshot Optimized,,Mark Culliton Headshot Optimized,,,https://barrfdn-prod.s3.amazonaws.com/image/3013/original.jpg,3013.jpg
3014,Yolanda Headshot,,Yolanda Headshot,,,https://barrfdn-prod.s3.amazonaws.com/image/3014/original.png,3014.png
3015,Jen Faigel Headshot,,Jen Faigel Headshot,,,https://barrfdn-prod.s3.amazonaws.com/image/3015/original.jpg,3015.jpg
3016,CommonWealth Kitchen logo,,CommonWealth Kitchen logo,,,https://barrfdn-prod.s3.amazonaws.com/image/3016/original.png,3016.png
3017,CommonWealth Kitchen Group Shot,,Group photo of CommonWealth Kitchen entrepreneurs,,http://www.commonwealthkitchen.org/,https://barrfdn-prod.s3.amazonaws.com/image/3017/original.jpg,3017.jpg
3018,CommonWealth Kitchen entrepreneur,,CommonWealth Kitchen entrepreneur posing with her food product. ,,http://www.commonwealthkitchen.org/,https://barrfdn-prod.s3.amazonaws.com/image/3018/original.jpg,3018.jpg
3019,Commonwealth kitchen group shot outside,,Commonwealth kitchen group shot outside,,,https://barrfdn-prod.s3.amazonaws.com/image/3019/original.jpeg,3019.jpeg
3020,CommonWealth Kitchen entrepreneur in the kitchen,,CommonWealth Kitchen entrepreneur in the kitchen,,http://www.commonwealthkitchen.org/,https://barrfdn-prod.s3.amazonaws.com/image/3020/original.jpg,3020.jpg
3021,Emily Reichert Headshot,,Emily Reichert Headshot,,,https://barrfdn-prod.s3.amazonaws.com/image/3021/original.jpg,3021.jpg
3022,Greentown Labs building,,Greentown Labs building,,,https://barrfdn-prod.s3.amazonaws.com/image/3022/original.jpg,3022.jpg
3023,Brazilian Worker Center Logo,,Brazilian Worker Center Logo,,,https://barrfdn-prod.s3.amazonaws.com/image/3023/original.jpg,3023.jpg
3024,Brazilian Worker Center group photo,,Brazilian Worker Center group photo,,https://www.braziliancenter.org/,https://barrfdn-prod.s3.amazonaws.com/image/3024/original.jpg,3024.jpg
3025,"Natalícia Tracy, Ph.D. headshot",,"Natalícia Tracy, Ph.D.",,,https://barrfdn-prod.s3.amazonaws.com/image/3025/original.jpg,3025.jpg
3026,Father John Headshot,,Father John Unni,,,https://barrfdn-prod.s3.amazonaws.com/image/3026/original.jpg,3026.jpg
3027,Father Paul with Fire Dept,,Father John Unni posing with the Boston fire department,,https://stceciliaboston.org/,https://barrfdn-prod.s3.amazonaws.com/image/3027/original.jpg,3027.jpg
3028,StCeciliaParish Square logo,,StCeciliaParish Square logo,,,https://barrfdn-prod.s3.amazonaws.com/image/3028/original.jpg,3028.jpg
3029,JVS logo,,JVS logo,,,https://barrfdn-prod.s3.amazonaws.com/image/3029/original.png,3029.png
3030,JVS Group photo,,JVS Group photo,,https://www.jvs-boston.org/,https://barrfdn-prod.s3.amazonaws.com/image/3030/original.jpg,3030.jpg
3031,Jerry Rubin headshot,,Jerry Rubin headshot,,,https://barrfdn-prod.s3.amazonaws.com/image/3031/original.jpg,3031.jpg
3032,JVS Interaction,,JVS Interaction,,https://www.jvs-boston.org/,https://barrfdn-prod.s3.amazonaws.com/image/3032/original.jpg,3032.jpg
3033,Anita PAIR project podium,,Anita PAIR project podium,,https://www.pairproject.org/,https://barrfdn-prod.s3.amazonaws.com/image/3033/original.jpg,3033.jpg
3034,PAIR Group photo,,PAIR Group photo,,https://www.pairproject.org/,https://barrfdn-prod.s3.amazonaws.com/image/3034/original.jpg,3034.jpg
3035,PAIR logo,,PAIR logo,,,https://barrfdn-prod.s3.amazonaws.com/image/3035/original.jpg,3035.jpg
3036,Anita PAIR headshot,,Anita PAIR headshot,,,https://barrfdn-prod.s3.amazonaws.com/image/3036/original.jpg,3036.jpg
3037,Boston Collegiate logo,,Boston Collegiate logo,,,https://barrfdn-prod.s3.amazonaws.com/image/3037/original.jpg,3037.jpg
3038,Shannah headshot,,Shannah headshot,,,https://barrfdn-prod.s3.amazonaws.com/image/3038/original.jpg,3038.jpg
3039,BCCS Pride group photo,,BCCS Pride group photo,,https://www.bostoncollegiate.org/,https://barrfdn-prod.s3.amazonaws.com/image/3039/original.jpg,3039.jpg
3040,BSSC Grads,,BSSC Grads,,https://www.bostoncollegiate.org/,https://barrfdn-prod.s3.amazonaws.com/image/3040/original.jpg,3040.jpg
3041,Barr Fellows Announcement Graphic with names,,Congratulations Barr Fellows Class of 2019,,,https://barrfdn-prod.s3.amazonaws.com/image/3041/original.jpg,3041.jpg
3042,Barr Fellow Announcement No Names,,Congratulations Barr Fellows Class of 2019,,,https://barrfdn-prod.s3.amazonaws.com/image/3042/original.jpg,3042.jpg
3043,Barr Fellows Announcement Graphic Square,,Barr Fellows Announcement Graphic Square,,,https://barrfdn-prod.s3.amazonaws.com/image/3043/original.jpg,3043.jpg
3044,Vanessa Calderon Rosado Headshot,,Vanessa Calderon Rosado Headshot,,,https://barrfdn-prod.s3.amazonaws.com/image/3044/original.jpg,3044.jpg
3045,Vanessa Calderon Rosado Square Crop,,Vanessa Calderon Rosado Square Crop,,,https://barrfdn-prod.s3.amazonaws.com/image/3045/original.jpg,3045.jpg
3046,Caroline HW Headshot,,Caroline HW Headshot,,,https://barrfdn-prod.s3.amazonaws.com/image/3046/original.jpg,3046.jpg
3047,Trustees Combined Photo,,Trustees Combined Photo,,,https://barrfdn-prod.s3.amazonaws.com/image/3047/original.jpg,3047.jpg
3048,WLE Cohort Group Photo,"Education, Wider learning ecosystem",Group of school leaders posing at a workshop. ,,,https://barrfdn-prod.s3.amazonaws.com/image/3048/original.jpg,3048.jpg
3049,College Readiness icon,,Graphic representing college readiness ,,,https://barrfdn-prod.s3.amazonaws.com/image/3049/original.jpg,3049.jpg
3050,Job Shadowing Icon,,Graphic of two shadows representing job shadowing.,,,https://barrfdn-prod.s3.amazonaws.com/image/3050/original.jpg,3050.jpg
3051,Anywhere learning icon,,Graphic of a tent by a tree. ,,,https://barrfdn-prod.s3.amazonaws.com/image/3051/original.jpg,3051.jpg
3052,Job shadowing icon 2,,Job shadowing icon 2,,,https://barrfdn-prod.s3.amazonaws.com/image/3052/original.jpg,3052.jpg
3053,WLE Icons together,,Three icons representing a wider learning ecosystem,,,https://barrfdn-prod.s3.amazonaws.com/image/3053/original.jpg,3053.jpg
3054,Hillary O headshot,,Photo of blog author Hillary Oravec,,,https://barrfdn-prod.s3.amazonaws.com/image/3054/original.png,3054.png
3059,PoG Info webinar screenshot,,testing,,,https://barrfdn-prod.s3.amazonaws.com/image/3059/original.png,3059.png
3060,pog webinar slides screenshot,,pog webinar slides screenshot,,,https://barrfdn-prod.s3.amazonaws.com/image/3060/original.png,3060.png
3061,Everett BRT pilot with flowers,bosbrt,A bus pulls up to a bus stop that is decorated with thousands of flowers. ,,Ad Hoc,https://barrfdn-prod.s3.amazonaws.com/image/3061/original.jpg,3061.jpg
3062,BosBRT Pedicabs,bosbrt,Two men in pedi cabs leaning against a BostonBRT sign raising their hands in the air. ,Ad Hoc,http://www.bostonbrt.org/,https://barrfdn-prod.s3.amazonaws.com/image/3062/original.jpg,3062.jpg
3063,BosBRT banner and t shirt,,Elderly woman holding up a BRT t-shirt and smiling. ,Ad Hoc,http://www.bostonbrt.org/,https://barrfdn-prod.s3.amazonaws.com/image/3063/original.jpg,3063.jpg
3064,global arts live logo,,global arts live logo,,,https://barrfdn-prod.s3.amazonaws.com/image/3064/original.png,3064.png
3065,Red Carpet Everett,"BostonBRT, BRT",Construction worker painting a bus lane red.,Ad Hoc,http://www.bostonbrt.org/,https://barrfdn-prod.s3.amazonaws.com/image/3065/original.jpg,3065.jpg
3066,Race to Lead people talking at table,,People sit at a table and have a conversation. ,#wocintechchat,https://twitter.com/search?q=%23wocintechchat&src=typed_query,https://barrfdn-prod.s3.amazonaws.com/image/3066/original.jpg,3066.jpg
3067,Yvonne Belanger white headshot 2019,,Yvonne Belanger white headshot 2019,,,https://barrfdn-prod.s3.amazonaws.com/image/3067/original.jpg,3067.jpg
3068,Yvonne Belanger brick headshot 2019,,Yvonne Belanger brick headshot 2019,,,https://barrfdn-prod.s3.amazonaws.com/image/3068/original.jpg,3068.jpg
3069,Dave geary white headshot 2019,,Dave geary white headshot 2019,,,https://barrfdn-prod.s3.amazonaws.com/image/3069/original.jpg,3069.jpg
3070,dave geary brick headshot 2019,,dave geary brick headshot 2019,,,https://barrfdn-prod.s3.amazonaws.com/image/3070/original.jpg,3070.jpg
3071,san san wong white headshot 2019,,san san wong white headshot 2019,,,https://barrfdn-prod.s3.amazonaws.com/image/3071/original.jpg,3071.jpg
3072,san san wong brick headshot 2019,,san san wong brick headshot 2019,,,https://barrfdn-prod.s3.amazonaws.com/image/3072/original.jpg,3072.jpg
3073,trevor white headshot 2019,,trevor white headshot 2019,,,https://barrfdn-prod.s3.amazonaws.com/image/3073/original.jpg,3073.jpg
3074,cindy lung white headshot 2019,,cindy lung white headshot 2019,,,https://barrfdn-prod.s3.amazonaws.com/image/3074/original.jpg,3074.jpg
3075,cindy lung brick headshot 2019,,cindy lung brick headshot 2019,,,https://barrfdn-prod.s3.amazonaws.com/image/3075/original.jpg,3075.jpg
3076,Cecilia Hylton white headshot 2019,,Cecilia Hylton white headshot 2019,,,https://barrfdn-prod.s3.amazonaws.com/image/3076/original.jpg,3076.jpg
3077,Cecilia Hylton brick headshot 2019,,Cecilia Hylton brick headshot 2019,,,https://barrfdn-prod.s3.amazonaws.com/image/3077/original.jpg,3077.jpg
3078,ali gross white headshot 2019,,ali gross white headshot 2019,,,https://barrfdn-prod.s3.amazonaws.com/image/3078/original.jpg,3078.jpg
3079,sueellen kroll white headshot 2019,,sueellen kroll white headshot 2019,,,https://barrfdn-prod.s3.amazonaws.com/image/3079/original.jpg,3079.jpg
3080,sueellen kroll brick headshot 2019,,sueellen kroll brick headshot 2019,,,https://barrfdn-prod.s3.amazonaws.com/image/3080/original.jpg,3080.jpg
3081,ali gross brick headshot 2019,,ali gross brick headshot 2019,,,https://barrfdn-prod.s3.amazonaws.com/image/3081/original.jpg,3081.jpg
3082,mary skelton roberts white headshot 2019,,mary skelton roberts white headshot 2019,,,https://barrfdn-prod.s3.amazonaws.com/image/3082/original.jpg,3082.jpg
3083,mary skelton roberts brick headshot 2019,,mary skelton roberts brick headshot 2019,,,https://barrfdn-prod.s3.amazonaws.com/image/3083/original.jpg,3083.jpg
3084,mariella puerto white headshot 2019,,mariella puerto white headshot 2019,,,https://barrfdn-prod.s3.amazonaws.com/image/3084/original.jpg,3084.jpg
3085,mariella puerto brick headshot 2019,,mariella puerto brick headshot 2019,,,https://barrfdn-prod.s3.amazonaws.com/image/3085/original.jpg,3085.jpg
3086,maia white white background 2019,,maia white white background 2019,,,https://barrfdn-prod.s3.amazonaws.com/image/3086/original.jpg,3086.jpg
3087,maia white brick headshot 2019,,maia white brick headshot 2019,,,https://barrfdn-prod.s3.amazonaws.com/image/3087/original.jpg,3087.jpg
3088,nina minella white background headshot 2019,,nina minella white background headshot 2019,,,https://barrfdn-prod.s3.amazonaws.com/image/3088/original.jpg,3088.jpg
3089,nina minella brick headshot 2019,,nina minella brick headshot 2019,,,https://barrfdn-prod.s3.amazonaws.com/image/3089/original.jpg,3089.jpg
3090,prerna white headshot 2019,,prerna white headshot 2019,,,https://barrfdn-prod.s3.amazonaws.com/image/3090/original.jpg,3090.jpg
3091,prerna brick headshot 2019,,prerna brick headshot 2019,,,https://barrfdn-prod.s3.amazonaws.com/image/3091/original.jpg,3091.jpg
3092,jim canales white headshot 2019,,jim canales white headshot 2019,,,https://barrfdn-prod.s3.amazonaws.com/image/3092/original.jpg,3092.jpg
3093,jim canales brick headshot 2019,,jim canales brick headshot 2019,,,https://barrfdn-prod.s3.amazonaws.com/image/3093/original.jpg,3093.jpg
3094,jenny curtin white headshot 2019,,jenny curtin white headshot 2019,,,https://barrfdn-prod.s3.amazonaws.com/image/3094/original.jpg,3094.jpg
3095,jenny curtin brick headshot 2019,,jenny curtin brick headshot 2019,,,https://barrfdn-prod.s3.amazonaws.com/image/3095/original.jpg,3095.jpg
3096,christi craig white headshot 2019,,christi craig white headshot 2019,,,https://barrfdn-prod.s3.amazonaws.com/image/3096/original.jpg,3096.jpg
3097,christi craig brick headshot 2019,,christi craig brick headshot 2019,,,https://barrfdn-prod.s3.amazonaws.com/image/3097/original.jpg,3097.jpg
3098,jim jacket brick headshot,,jim jacket brick headshot,,,https://barrfdn-prod.s3.amazonaws.com/image/3098/original.jpg,3098.jpg
3099,lisa jacobson white headshot 2019,,lisa jacobson white headshot 2019,,,https://barrfdn-prod.s3.amazonaws.com/image/3099/original.jpg,3099.jpg
3100,lisa jacobson brick headshot 2019,,lisa jacobson brick headshot 2019,,,https://barrfdn-prod.s3.amazonaws.com/image/3100/original.jpg,3100.jpg
3101,shanna cleveland white headshot 2019,,shanna cleveland white headshot 2019,,,https://barrfdn-prod.s3.amazonaws.com/image/3101/original.jpg,3101.jpg
3102,shanna cleveland brick headshot 2019,,shanna cleveland brick headshot 2019,,,https://barrfdn-prod.s3.amazonaws.com/image/3102/original.jpg,3102.jpg
3103,jane joyce white headshot 2019,,jane joyce white headshot 2019,,,https://barrfdn-prod.s3.amazonaws.com/image/3103/original.jpg,3103.jpg
3104,jane joyce brick headshot 2019,,jane joyce brick headshot 2019,,,https://barrfdn-prod.s3.amazonaws.com/image/3104/original.jpg,3104.jpg
3105,jill horwood white headshot 2019,,jill horwood white headshot 2019,,,https://barrfdn-prod.s3.amazonaws.com/image/3105/original.jpg,3105.jpg
3106,jill horwood brick headshot 2019,,jill horwood brick headshot 2019,,,https://barrfdn-prod.s3.amazonaws.com/image/3106/original.jpg,3106.jpg
3107,anya rooney white headshot 2019,,anya rooney white headshot 2019,,,https://barrfdn-prod.s3.amazonaws.com/image/3107/original.jpg,3107.jpg
3108,kalila white background 2019,,kalila white background 2019,,,https://barrfdn-prod.s3.amazonaws.com/image/3108/original.jpg,3108.jpg
3109,stefan white background 2019,,stefan white background 2019,,,https://barrfdn-prod.s3.amazonaws.com/image/3109/original.jpg,3109.jpg
3110,stefan brick background 2019,,stefan brick background 2019,,,https://barrfdn-prod.s3.amazonaws.com/image/3110/original.jpg,3110.jpg
3111,jaime lopez white background 2019,,jaime lopez white background 2019,,,https://barrfdn-prod.s3.amazonaws.com/image/3111/original.jpg,3111.jpg
3112,jaime lopez brick background 2019,,jaime lopez brick background 2019,,,https://barrfdn-prod.s3.amazonaws.com/image/3112/original.jpg,3112.jpg
3113,kim haskins white background 2019,,kim haskins white background 2019,,,https://barrfdn-prod.s3.amazonaws.com/image/3113/original.jpg,3113.jpg
3114,kim haskins brick background 2019,,kim haskins brick background 2019,,,https://barrfdn-prod.s3.amazonaws.com/image/3114/original.jpg,3114.jpg
3115,kerri hurley white background 2019,,kerri hurley white background 2019,,,https://barrfdn-prod.s3.amazonaws.com/image/3115/original.jpg,3115.jpg
3116,kerri hurley brick background 2019,,kerri hurley brick background 2019,,,https://barrfdn-prod.s3.amazonaws.com/image/3116/original.jpg,3116.jpg
3117,barbara hostetter brick background 2019,,barbara hostetter brick background 2019,,,https://barrfdn-prod.s3.amazonaws.com/image/3117/original.jpg,3117.jpg
3118,sam alper white background 2019,,sam alper white background 2019,,,https://barrfdn-prod.s3.amazonaws.com/image/3118/original.jpg,3118.jpg
3119,sam alper brick background 2019,,sam alper brick background 2019,,,https://barrfdn-prod.s3.amazonaws.com/image/3119/original.jpg,3119.jpg
3120,mary chalifour white background 2019,,mary chalifour white background 2019,,,https://barrfdn-prod.s3.amazonaws.com/image/3120/original.jpg,3120.jpg
3121,mary chalifour brick background 2019,,mary chalifour brick background 2019,,,https://barrfdn-prod.s3.amazonaws.com/image/3121/original.jpg,3121.jpg
3122,anya rooney brick headshot 2019,,anya rooney brick headshot 2019,,,https://barrfdn-prod.s3.amazonaws.com/image/3122/original.jpg,3122.jpg
3123,man installs solar panels in lowell,,A man installs solar panels on a roof in Lowell.,Jerry Monkman,http://ecophotography.com/,https://barrfdn-prod.s3.amazonaws.com/image/3123/original.jpg,3123.jpg
3124,kate dobin brick headshot 2019,,kate dobin brick headshot 2019,,,https://barrfdn-prod.s3.amazonaws.com/image/3124/original.jpg,3124.jpg
3125,kate dobin white headshot 2019,,kate dobin white headshot 2019,,,https://barrfdn-prod.s3.amazonaws.com/image/3125/original.jpg,3125.jpg
3126,john dello russo white headshot 2019,,john dello russo white headshot 2019,,,https://barrfdn-prod.s3.amazonaws.com/image/3126/original.jpg,3126.jpg
3127,john dello russo brick headshot 2019,,john dello russo brick headshot 2019,,,https://barrfdn-prod.s3.amazonaws.com/image/3127/original.jpg,3127.jpg
3128,christi craig white edit headshot 2019,,christi craig white edit headshot 2019,,,https://barrfdn-prod.s3.amazonaws.com/image/3128/original.jpg,3128.jpg
3130,yvonne white edit headshot 2019,,yvonne white edit headshot 2019,,,https://barrfdn-prod.s3.amazonaws.com/image/3130/original.jpg,3130.jpg
3131,ali gross white edit headshot 2019,,ali gross white edit headshot 2019,,,https://barrfdn-prod.s3.amazonaws.com/image/3131/original.jpg,3131.jpg
3132,kalila white edit headshot 2019,,kalila white edit headshot 2019,,,https://barrfdn-prod.s3.amazonaws.com/image/3132/original.jpg,3132.jpg
3134,jenny curtin white edit headshot 2019,,jenny curtin white edit headshot 2019,,,https://barrfdn-prod.s3.amazonaws.com/image/3134/original.jpg,3134.jpg
3135,mapc trip to the beach resilience,,Two people walk along the beach. ,Leonardo March,https://www.mneyid.com/,https://barrfdn-prod.s3.amazonaws.com/image/3135/original.jpg,3135.jpg
3136,kalila barnett brick 2019 headshot,,kalila barnett brick 2019 headshot,,,https://barrfdn-prod.s3.amazonaws.com/image/3136/original.jpg,3136.jpg
3137,iba preschool graduation photo,,Preschoolers graduate from preschool. ,Inquilinos Boricuas en Acción ,http://ibaboston.org/preschool/?fbclid=IwAR31SeXovJtFOrgOoAw5zBDChgJ9-vC6nwgkPqjnM6rJ0Jwqu5waB2ZETmU,https://barrfdn-prod.s3.amazonaws.com/image/3137/original.jpg,3137.jpg
3138,Let's Hear It Logo,"podcast, let's hear it",Let's Heart It! podcast logo,Let's Hear It,https://www.letshearitcast.com/,https://barrfdn-prod.s3.amazonaws.com/image/3138/original.png,3138.png
3139,greenroots teens meeting,,Teens talk at a meeting. ,,,https://barrfdn-prod.s3.amazonaws.com/image/3139/original.jpg,3139.jpg
3140,PRX woman interviews woman,,Two women speak for a podcast. ,https://www.podcastgarage.org/,,https://barrfdn-prod.s3.amazonaws.com/image/3140/original.jpg,3140.jpg
3141,prx women work on a podcast,,prx women work on a podcast,,https://www.podcastgarage.org/,https://barrfdn-prod.s3.amazonaws.com/image/3141/original.jpg,3141.jpg
3142,laura baring gould children make art,,A woman and children make art at a table. ,Maureen White Photography,https://www.maureenwhitephotography.com/,https://barrfdn-prod.s3.amazonaws.com/image/3142/original.jpg,3142.jpg
3143,company one theatre rap scene,,company one theatre rap scene,Paul Fox,https://www.paulfox.photography/,https://barrfdn-prod.s3.amazonaws.com/image/3143/original.jpg,3143.jpg
3144,green energy consumers logo,,green energy consumers logo,,,https://barrfdn-prod.s3.amazonaws.com/image/3144/original.jpg,3144.jpg
3145,jerry monkman aerial shot solar panels,,Two men install solar panels on the roof of a home. ,Jerry Monkman,http://ecophotography.com/,https://barrfdn-prod.s3.amazonaws.com/image/3145/original.jpg,3145.jpg
3146,ednavigator two women talk over laptop,,Two women talk over a laptop. ,Paul Schnaittacher,https://photogman.smugmug.com/,https://barrfdn-prod.s3.amazonaws.com/image/3146/original.jpg,3146.jpg
3147,ednavigator square logo,,ednavigator square logo,,,https://barrfdn-prod.s3.amazonaws.com/image/3147/original.png,3147.png
3148,School Facts logo,,School Facts logo,,,https://barrfdn-prod.s3.amazonaws.com/image/3148/original.png,3148.png
3149,Mass Parents United logo,,Mass Parents United logo,,,https://barrfdn-prod.s3.amazonaws.com/image/3149/original.jpg,3149.jpg
3150,Tammy Blackman headshot,,Tammy Blackman headshot,,,https://barrfdn-prod.s3.amazonaws.com/image/3150/original.png,3150.png
3151,Doris Roach headshot,,Doris Roach headshot,,,https://barrfdn-prod.s3.amazonaws.com/image/3151/original.jpg,3151.jpg
3152,Jackie J,,Jackie J,,,https://barrfdn-prod.s3.amazonaws.com/image/3152/original.png,3152.png
3153,Jackie Jenkins Headshot,,Jackie Jenkins Headshot,,,https://barrfdn-prod.s3.amazonaws.com/image/3153/original.jpg,3153.jpg
3154,Liz O’Connor headshot,,Liz O’Connor headshot,,,https://barrfdn-prod.s3.amazonaws.com/image/3154/original.jpg,3154.jpg
3155,Viveka Chen,,Viveka Chen,,,https://barrfdn-prod.s3.amazonaws.com/image/3155/original.png,3155.png
3156,Creative Commonwealth BCTF Artist Grantee,"Creative Commonwealth, Artist, Artist of Color, Pottery, Berkshire Taconic","Photo of artist in entryway to pottery studio - IS183, which is an Arts Build Community grantee of the Berkshire Taconic Community Foundation - photo by John Dolan",John Dolan,www.johndolan.com,https://barrfdn-prod.s3.amazonaws.com/image/3156/original.jpg,3156.jpg
3157,Essex Public Art Launch Food Table,"People, food, public art, creative commonwealth, essex",Photo of people gathered at food table for launch of public art in Essex County,Creative Collective,https://www.creativecollectivema.com,https://barrfdn-prod.s3.amazonaws.com/image/3157/original.jpg,3157.jpg
3158,Jordan Pixability,,Jordan Pixability,,,https://barrfdn-prod.s3.amazonaws.com/image/3158/original.jpg,3158.jpg
3159,Dancers Beyond Walls Lynn ECCF,"Creative Commonwealth, Essex, Beyond Walls, Lynn","Image of two people dancing at Beyond Walls event in Lynn Massachusetts. Photo courtesy of Essex County Community Foundation by John Andrews, photographer, Creative Collective",John Andrews,https://www.creativecollectivema.com/the-collective,https://barrfdn-prod.s3.amazonaws.com/image/3159/original.jpg,3159.jpg
3160,BKMAI Adaptive Capacity Training,"arts, BKMAI",Woman speaks in front of a crowd of people sitting in a conference room.,,,https://barrfdn-prod.s3.amazonaws.com/image/3160/original.png,3160.png
3193,teacher perspective screenshot,,teacher perspective screenshot,,,https://barrfdn-prod.s3.amazonaws.com/image/3193/original.png,3193.png
3194,the canopy photo,,the canopy photo,,,https://barrfdn-prod.s3.amazonaws.com/image/3194/original.jpg,3194.jpg
3195,developing a new vision cover,,developing a new vision cover,,,https://barrfdn-prod.s3.amazonaws.com/image/3195/original.png,3195.png
3196,ENE SRI Learnings cover,,ENE SRI Learnings cover,,,https://barrfdn-prod.s3.amazonaws.com/image/3196/original.png,3196.png
3197,holyoke students robots,,holyoke students robots,,,https://barrfdn-prod.s3.amazonaws.com/image/3197/original.jpg,3197.jpg
3198,latinos for education people clapping,,People clap in a circle. ,Latinos for Education,https://www.latinosforeducation.org/,https://barrfdn-prod.s3.amazonaws.com/image/3198/original.jpg,3198.jpg
3199,Holyoke Girls walking the hallway,,Three girls walk in the hallway. ,,https://photogman.smugmug.com/,https://barrfdn-prod.s3.amazonaws.com/image/3199/original.jpg,3199.jpg
3200,Minds At Work Training,,Coach from Minds at Work in front of a group of people in a classroom style. ,,,https://barrfdn-prod.s3.amazonaws.com/image/3200/original.jpg,3200.jpg
3201,Oslo street,Mobility,"Biker goes down a street with no cars on it, only people, in Oslo. ",Geir Anders Rybakken Ørslien,https://www.urban-future.org/,https://barrfdn-prod.s3.amazonaws.com/image/3201/original.jpg,3201.jpg
3202,Urban Future square,,Urban Future square,,,https://barrfdn-prod.s3.amazonaws.com/image/3202/original.jpg,3202.jpg
3203,The Canopy square crop,,The Canopy square crop,Christensen Institute,https://www.christenseninstitute.org/,https://barrfdn-prod.s3.amazonaws.com/image/3203/original.jpg,3203.jpg
3204,sonia chang diaz,,sonia chang diaz,,,https://barrfdn-prod.s3.amazonaws.com/image/3204/original.jpg,3204.jpg
3205,woman paints mural community foundation southeastern,,A woman paints a mural outdoors. ,Erin Long,https://erinlongphotography.com/,https://barrfdn-prod.s3.amazonaws.com/image/3205/original.jpg,3205.jpg
3206,man poses with mural southeastern ma,,A man poses happily with a mural. ,John Robson,https://johnrobson.photography/,https://barrfdn-prod.s3.amazonaws.com/image/3206/original.jpg,3206.jpg
3207,John Vasconcellos Headshot,,John Vasconcellos Headshot,,,https://barrfdn-prod.s3.amazonaws.com/image/3207/original.jpg,3207.jpg
3208,rayana grace headshot,,rayana grace headshot,,,https://barrfdn-prod.s3.amazonaws.com/image/3208/original.jpg,3208.jpg
3209,NAS Retreat Circle,"Circle, group, group work",Group of adults in circle with attention on smiling woman of color speaking in the center,"Photo by Eva Cruz ""Crouching Tiger LLC""",http://crouchingtigerllc.com/bio,https://barrfdn-prod.s3.amazonaws.com/image/3209/original.jpg,3209.jpg
